"company_pk","cosine_distance","text_raw"
1367888,"0.2699007770389288","Underline offers a highly customizable and interactive online video platform, where you can find the best lectures, presentations and discussions from the most important conferences in your field. Viewers can then engage with conference materials from wherever they want, whenever they want. Conferences play a significant role in the advancement of science. They connect like minds, facilitate networking opportunities, reveal the latest research in the subject, and provide opportunities to develop new skills. But they present challenges. They can be expensive, present scheduling challenges, be in a different language and all the discussions end with the conferences. Our Mission is to digitize scientific conference information and make it globally accessible and useful."
2398395,"0.269975050093219","Veloxity is a collection of innovative, like-minded folks disrupting the way data technology works, for now and for the future. WE ARE • A Proprietary Data Owner that collects GDPR compliant first party data from mobile devices, • A Technology Platform that allows analysis and learning of consumer’s real life habits and behavior • An Actionable Insight Company focused on providing customized solutions to a wide range of industries including but not limited to Banking, Technology Investment, FMCG, Telecommunications, E- Commerce, Smart AdTech, Retail, Smartphone Companies, Municipalities, and Digital TV networks. WHAT WE DO Veloxity’s main strength is to convert its proprietary data into knowledge and action, which enables businesses to better understand consumers and their decision-making drivers that leads to a money generating commercial transaction. This is accomplished by providing real-time insight into actual consumer habits and purchasing behavior via Veloxity’s patented behavior data analytics technology. VELOXITY DIFFERENCE Unlike other companies, Veloxity is a proprietary data owner and its solutions are based on the actual data that defines an individual’s daily routines and does not rely on artificial social media “claims”, likes/dislikes/shares or narrow customer (often “idealized”) survey results. Instead, it draws on the hard data of what people actually do and when they do it. Veloxity’s real time/dynamic data sourcing and analytical processing technology translates these daily routines into habit definitions, future behavior patterns and predictions, which then enables its clients to access the right customer at the right time."
5012469,"0.27011701224839024","LUFE is a collection of wood furniture. They are recyclable furniture, made with solid pine wood from national and sustainable forests. The furniture can only be purchased online, which allows them to eliminate marketing costs and reduce intermediaries so that the purchase is made directly with them, the manufacturers. All furniture manufactured with a polished solid wood finish has a delivery time of two weeks from the confirmation of the order."
5679746,"0.270150379547467","Clean Direct is the #1 source for specialty cleaning equipment. We are home to SkyVac USA & Canada, The Mosmatic Professional and many other specialty cleaning brands."
1723111,"0.27050515764889704","Navi is a company with a vision to deliver brighter, healthier futures for children around the world by addressing important unmet needs in pediatric medicine. Founded in Melbourne, Australia, Navi is currently working on a FDA Breakthrough medical device that addresses needs for critically-ill children, and has raised over $7m in funding, including through prestigious grants & FDA-sponsored programs. Navi's multi-award winning team with a fun, diverse and collaborative culture, with a passion to innovative solutions to real-world medical challenges."
1362620,"0.2705453690398819","SweTree Technologies is a forest biotech company providing innovative products and technologies improving the productivity and properties of trees thereby increasing the amount of biomass/fiber produced per hectare. We consider the forest resources to being an inevitable part of the conversion to a bio-based economy. Our vision is to be one of the world-leading providers of new and sustainable technologies based on biological knowledge for tree plant producers and forest owners globally. The R&D is conducted in close collaboration with scientists in Umeå Plant Science Center (UPSC), one of the world’s leading academic environments for forest biotechnology, and Woodheads managing Biotech innovations of over 40 leading researchers from five Swedish universities. The collaboration has resulted in technologies commercially available through SweTree Technologies."
2240771,"0.2711623311042578","Sēkr is a crowdsourced mobile platform making every step of the outdoor travel planning experience easier, safer, and more social. The company is creating an inclusive community through access to 50K+ campsites, including the nation’s largest database of free campsites, and local outdoor events."
6741951,"0.27138405484410677","Our Generators is an online retailer providing competitive prices on generators and smart chargers as well as a memorable experience when you shop at our store."
6348998,"0.2714432154365469","Recruit Ninjas offers a single platform for building your own full-time, cost-effective remote team globally by providing you an end-to-end solution right from hiring employees, taking care of contracts and compliances and EOR, payrolls and the complete employee management cycle in 20+ countries. We have a team of 40+ specialized recruiters across the world. At Recruit Ninjas you will be able to: -Hire top 3% of global talent hiring in just 2 weeks from 20+ countries on contingency -Have us take care of compliances, contracts and payrolls in all countries -Enjoy transparent and easy salary and fee payments that are the lowest in the industry -Get continuous support for culture training, HR and L&D -Post your job free"
6651279,"0.2715147733688148","Precision Engineering | Pinpoint Accuracy | Premium Quality Parts Terran Industries is setting new expectations by bringing the latest innovations with decades of experience in the automotive and trailer industry. Our products set a new standard of reliability and quality at competitive prices by ensuring consistency and precision in our engineering and automated seamless welding. Our commitment to you is ensuring our products make a positive impact on your success."
3058181,"0.2715520211334178","We’re not just a partner, we are audacious, a collection of four uniquely talented marketing and customer experience teams who revel in uncovering actionable opportunities versus solving one-off problems. All so brands can unlock outcomes faster. Each team is equipped with smart yet practical people and enabling technology and resources best suited to the task at hand. As such, we are decidedly full-fledged, not full-service. We are four teams serving distinct needs: Sitewire (Digital Design + Development), Cast & Hue (Customer Experience Consulting), August United (Influencer Marketing), and Tailwind (Performance Marketing / Media Buying)."
2517842,"0.2717283750389876","SnapDNA is reducing sample-to-answer results for pathogen testing from up to 3 days or more to as little as 20 minutes, enabling food processors to save millions of dollars and allowing faster reaction to possible contamination to ensure a safer food supply."
3573068,"0.2718633847317946","We are a Singapore retail distributor with a strong background in the foodservice industry. Our ambition is to become a provider of good brand names and food products in the retail sector. We are here not only to sell products, but more importantly, brands, knowledge and experience. In 2013, we launched groXers.com to fulfill our dream of reaching out to home consumers directly."
4547745,"0.27188011743066776","At Stallions Solutions, we passionately believe that we are successful in delivering excellence to our clients because we deliberately seek to hire 'Brilliant' people. We strive to encourage diversity across our team and to optimize the deployment of our collective talent to enable the delivery of outstanding results for our clients. We believe the best way to do this is to give our people the space and flexibility to succeed We are leaders in delivering Microsoft Business Applications solutions and the Dynamics 365 workloads through unparalleled offerings of service, support, education, and add-ons. We strive to become the leading Microsoft Business Applications Provider in the world by delivering solutions that help organizations increase productivity, streamline business processes, and build better relationships. We are skilled at simplifying business processes and enhancing business performance to drive growth, profitability and efficiency. Providing business consulting, design, implementation and managed services out of our London headquarters, we have successfully deployed Microsoft Dynamics. We also provide cloud employees working as an extension of your current workforce remotely. Using this ''Right Sourcing'' model, our teams or employees are dedicated to your company and provide a bespoke service as per the clients requirement. We provide customers hassle free expansion without them having to invest in expensive infrastructure and office space. We are gradually becoming the first choice of smart thinking companies and have over 200 staff serving the needs of our international industry leader clients."
1494793,"0.2721012940225659","Whop is building a platform to service the internet economy. Millions of people are building new products that they are selling guerrilla style on social media and on forums throughout the internet. Whop gives these sellers a sleek storefront that can accept payments, seamlessly deliver digital products, and attract new customers visiting our marketplace. We currently handle almost $150M+ in yearly payments with thousands of active merchants. To view our open roles, please visit https://careers.whop.com"
2121307,"0.2721079046629672","SnapAttack is the enterprise-ready platform that helps security leaders answer their most pressing question: “Are we protected?” By rolling intel, adversary emulation, detection engineering, threat hunting, and purple teaming into a single, easy-to-use product with a no-code interface, SnapAttack enables you to get more from your technologies, more from your teams, and makes staying ahead of the threat not only possible - but also achievable."
6023617,"0.27223069568323444","We are your number one source to get your business online as well any in-house functional application. We're a team of professionals dedicated to give you the very best Advertising, Social Media and Web Solutions while being affordable. Our goal is to improve your business presence and increase your marketing strategies. We offer high quality products to our clients including social media, advertising services, audiovisual production, professional web design, corporate identity, web advertising, web marketing, graphic design services, and custom software. We provide all you need to be a successful business in the media. We offer custom design, web hosting, email services and more for an affordable price. We are very competitive with our prices and guarantee our clients satisfaction. We hope you give us the opportunity to earn your business. We enjoy working with new and old clients in developing a product that will meet their unique business needs. If you have any questions or comments, please don’t hesitate to contact us. Keep in mind that for Cute Digital Media, a referral is the highest compliment you can give any of us. Thank you for the opportunity. Sincerely, Nidia Rojas, CEO."
5534459,"0.2722830500939679","For our team of analysts and geeks, communicative challenges and special tasks are the greatest: We work with enthusiasm and a strategically clear head - and without compromising on quality. Our customers appreciate us as part of their team - friendly and surprising. We love what we do, because many people can do it ""simple"". #WeareWE We let our customers shine. As a partner at your side, we have your back. Everything we do is focused on your success. Our approach is analytical, strategic and integrated. We're creative problem solvers, making sure you're looking good at the end of the quarter. And then throw your victory celebration."
4010869,"0.2723046541213783","Marks Mobility UK's No 1 mobility products online shop in Bristol offers mobility aids, disability aids, wheelchairs, electric mobility scooters, bath lifts etc"
4425420,"0.27236726613434437","Salveo Productions, LLC is a management consulting company specializing in professional project management, IT consulting services, agile consulting services, digital marketing, e-commerce, project staffing and business growth services."
3682890,"0.272615129324167","Haidion delivers high quality Identity and Access Management services: * Prestudies and roadmaps * Procurement support * Development, integration and deployment * Solution support"
2356589,"0.27278494291664535","Jenny Bay provides services that include custom design, white diamond, color diamond, pearl, gemstone, and diamond grading. The firm has a wide range of collections."
3614337,"0.27300983118776534","FREE estimates. Locally owned and operated. Bonded and insured. Janitorial, lawn care, snow removal, parking lots, windows, and more. Call 2187274513 today."
6282591,"0.27303442084378426","Jacob Title provides order, service, and success through each step of each real estate transaction. They address inquiries through phone, mail, and online applications."
2026645,"0.2731464775626038","netmix® develops Radio Station PRO, a powerful WordPress plugin giving broadcasters of any type the tools to manage a show schedule, publish show, episode, and team pages, and live stream with our persistent audio player bar for uninterrupted listener playback."
6556421,"0.2731639796646771","Our trusted tax experts are here for you to solve all your tax concerns with the technical expertise that brings you and your business growth."
3005075,"0.27322843947744957","Aperium is a Montreal based company aiming to help you shape the right content and technologies to enable your ideas with content that resonate with your audience and hardware that always works. Shall it be to drive internal productivity or to create memorable experiences at public events, we work with you from ideation to deployment."
6957809,"0.2732346491077635","Spear America is the largest purveyor of Freediving and Spearfishing equipment in the USA. We have two conveniently located dive shops in Orange County and Los Angeles and one in Fort Lauderdale, Florida. Call us to talk to an expert. Feel free to place an order over the phone during normal business hours. If you can't find a specific item on our website, let us know and we will track it down for you."
1362647,"0.2733146711179095","Serve Automation is changing the way your favorite food gets delivered. The company was founded by a group of intrepid ex-SpaceX engineers who want to revolutionize the food industry."
5821322,"0.27335928241256013","Natural Classics Since 1978 www.r-collection.com Instagram @rcollectionfinland Helsinki Kajaani Oulu Kajaani Factory Store, Kasarminkatu 8 Oulu, Kauppurienkatu 13 Helsinki, Fredrikinkatu 34"
5784997,"0.27340393700505805","Our knowledgeable and friendly staff strives to provide the best service for each customer, while taking pride to exceed industry standards. Reach us 24/7! Three generations of service has made Sam Pickren Air & Insulation a proud family-owned and -operated business, providing premium heating ventilation and air conditioning services to Saint Mary and its surrounding areas. As a CFAD dealer, we have the latest equipment and supplies to ensure that you're always getting quality work. We specialize in the repair and installation of heating and air conditioning systems, but we also provide testing for air quality, management for foam insulation, and air duct cleaning and tightening.  Call in today to schedule an appointment!"
1558602,"0.2734693288802894","Beeyond Media is an innovative programmatic DOOH advertising platform for brands and agencies to plan, schedule, and execute more intelligent, precise, and impactful out-of-home campaigns. We offer one of the largest media inventories and venues across the US and Latin America. Our mission is to revolutionize programmatic DOOH advertising and empower brands and agencies to achieve their growth objectives."
1430135,"0.273587188911804","Imagine a delightfully diverse, safe, healthy, and just world with clean air, water, soil, and power economically, equitably, ecologically, and elegantly enjoyed with an elegant solution that is designed in BC, crafted in Canada, for the world with a cradle to cradle design ethos. Our solutions are cloud-connected, ultra-efficient, reliable & robust electric motors & generators, engaging climate change mitigation. A matrix of solutions converging as one..."
1611695,"0.2738784004957081","blendFX is a young 3D animation and VFX studio in Leipzig / Germany. We started 2013 after already collaborating on various projects several times before."
3654885,"0.2739744725288218","Graf Industrial Corp is a blank check company. The Company is formed for the purpose of effecting a merger, capital stock exchange, asset acquisition, stock purchase, reorganization or similar business combination with one or more businesses. It intends to focus on industrial companies. It focuses on diversified industrial manufacturing, technology, distribution and service businesses, in the United States and Canada."
2358666,"0.27400336444277507","Order Pronto is much more than delivery! To receive at home, eat at the restaurant, withdraw or guarantee that drink at your favorite show. For you who have a restaurant, it&#39;s freedom to choose: delivery, withdrawal and table ordering. In addition to all the support so that your business can expand digitally."
2553507,"0.27407845037940204","Aries solutions is the first Indian company that provides ingenious solutions to the technology hindrance of human lives. We manufacture customized drones,robots and energy systems for the industrial sector and agriculture. We provide both consumer-level and customer-end customers with simple, smart,safe and high-efficient products .we are laying the platforms for the humanitarian to be live in the safest earth by directing the engineering capabilities to safe gaurd the earth."
2061634,"0.27408211849162134","No matter how you’re getting there, start with Parman Tractor & Equipment. We believe the brands we sell reflect our own brand of Totally Outrageous Customer Service. That’s why we partner with brands we trust and are proud to feature like New Holland Agriculture, New Holland Construction, Link-Belt, Takeuchi, Hitachi, Sakai, and Bushhog."
2121212,"0.2742434418112534","Our Founder, Architect Serina Calhoun wanted just one thing - to provide the highest quality service to her clients. After almost 18 years of practicing in San Francisco, she was fed up with bureaucratic red tape, surprise legislation affecting her clients, and unnecessary wasted time. In her dedication to do her part to solve the housing crisis, she encountered needless obstacles. It took 2 years to get just one accessory dwelling unit (ADU) project approved inside an existing building. For her that was the last straw. She fought for change and those same projects can be approved now in just 4 months. Going through that process made her realize a systemic change to the way we all make buildings was needed. In order to provide the highest quality service to our clients we all need: a larger network a conduit to stay informed about all upcoming legislation that impacts our clients an advocacy group to help steer legislation int he right direction for our clients better access to information and to pool our resources. Placemakers PRO was born. Our businesses can thrive if we grow our referral network, connect with new consultants, and partner to affect change. We can save our clients time and money by sharing resources like surveys and reports openly. We can bring significant value to our clients if we work together to impact new policies, codes, and legislation BEFORE they are enacted. If our industry is going to tackle solving the housing crisis and build 3.5M new units in the state of California, we have to figure out how to work faster. It’s time to break down our barriers and get to work together. That's why our vision for Property ATLAS is to create a new way of making buildings. Together. We can reinvent our industry by uniting architects, engineers, and contractors to create camaraderie, trust, and community."
7074711,"0.27424818277356944","Our homes, like everything else, require some upkeep. If you want to maintain your space up to date, you can employ the experts at Creative Vision Remodeling for home remodeling services to impress the onlookers. We are a team of skilled designers who successfully handle the furnishings to turn the client’s vision into reality while delivering home improvement services.  Address :- 5875 Braesheather Dr, Houston, TX 77096 Working Hours :- Mon To Fri - 8am–10pm Sun - 10am–4:30pm #homeremodel , #generalcontractor , #bellaire"
4510406,"0.27426152893254985","SnapIoT has created the most disruptive innovation in the clinical trials industry, snapClinical™, the first, complete, self-service, DIY-enabled mClinical Platform solution that provides the full scope of launching and managing digital clinical trials including, eQualification, eConsent, EDC, and ePRO/COA with full reporting/analytics, all without any software coding. The platform provides an intuitive, graphical, drag-and-drop interface that is highly flexible and empowers rapid development and deployment using a comprehensive set of smart device, Cloud, and enterprise-backend ""connectors"" that simply “snap” together, enabling end-to-end application creation, portable across different smart medical devices, smart mobile devices and Cloud Systems. snapClinical operates with four modules that work seamlessly together to design, create, edit, manage and launch/publish any digital clinical: • Workflow Library: The master library for created workflows and templates allowing you to edit or re-use any creation • Design Studio: Create the look and feel for any mobile device and the patient’s engagement. • Logic Engine: Allows you to tightly control the content and structure of all input and decision • Workflow Engine: Create the structure and flow of all processes in an mClinical trial The platform launches in each mobile devices’ native code, not just as a web browser, enabling the full set of iOS and Android features and capabilities to be used as part of patient engagement. And snapClinical’s library of supported 3rd Party providers includes EDCs, ePROs, EMR/EHRs, BLE medical devices, CLIA Medical and clinical labs, electronic signature systems (Adobe and DocuSign), beacons and sensors snapIoT’s business model is available as a self-service, DIY license to be used for as many clinical trials as needed, or snapIoT can provide a full turnkey mClinical trial solution for any study protocol using snapClinical."
1607743,"0.2742882640018097","PayWell is an organized retail approach by CloudWell Limited, focusing on providing convenient payments and value added services to major consumer service organizations in the utility, telecoms, healthcare, financial services, transport, retail, e-commerce, gaming and public sectors in Bangladesh. PayWell intends to deliver payments and services through a uniquely strong combination of local shops, internet and mobile distribution channels and it welcomes you to join the family."
2619985,"0.27462657992522443","We are the one-stop shop for high-quality digital solutions. Call us for Web Design & Development, App Development, Digital Marketing and more."
6084107,"0.27470570802686534","5Tel is a technology driven Telecommunication & Payment processing company which thrives on excellent customer service and affordable pricing. While other processors will give you the same solutions and products over and over again, 5Tel will ensure you have the latest technology and customer service satisfaction, making your business our number one priority."
6145625,"0.2748084880468542","Scotch Plaid has been manufacturing chemicals since 1953.  We offer superior chemicals for vehicle care, industrial and janitorial industries."
5701525,"0.27488150896053887","The Sleep Apnea market is at a tipping point - Americans can’t sleep! And they’re learning about Sleep Apnea. You can Be their CPAP Therapy supplier, expand to any U.S. state - or go global! VirtuSLEEP by VirtuOx is a sleep telemedicine program that allows DME companies to qualify patients for new medical equipment and existing patients with renewal prescriptions. To Sign Up, please call 877-579-0579."
4262142,"0.27497180998660886","PHD is an innovative Software Development and Digital Marketing Agency providing dynamic and collaborative perspective to our clients. Keeping stride with the rapid pace of digital trends we continuously monitor new strategies to stay ahead of the curve and anticipate future technologies. From uniquely designed mobile applications to data driven websites with digital marketing strategies, we propel our clients beyond their competition."
