"company_pk","cosine_distance","text_raw"
4034442,"0.30825883150098743","medibles is a whole-plant hemp health supplement company that offers you great CBD products. We seek to make a meaningful difference in your life and all of our customers’ lives worldwide by providing the next-generation subscription-based platform. We believe that companies shouldn't be built just to make money but to fulfill a much grander purpose in society. That belief is the pillar of our company’s foundation. A foundation that we should be a source for good and that our bottom line practices should not only lead to economic profitability but affect social and environmental change in a positive, meaningful way. We do this is by producing great CBD products that inspire trust and empowers you to imagine beyond the status quo, limited boundaries, and shape a much better world. We aim to take charge of the CBD industry with a high degree of transparency and the highest quality THC-free hemp oil products. When we develop our CBD products, we strive to make them with the best ingredients possible. We look to reduce their environmental impact and produce them in facilities that adhere to the highest standards. We started medibles with a simple mission: to utilize powerful, proprietary technology, science, and innovative products to deliver highly personalized, CBD products that optimize your health and well being. Our medibles brands consist of soft-gels, tinctures, topicals, edibles, and more. Our core values: Commitment to excellence in everything we do Excellence in reputation; Being part of something special Pathfinder---Being a pioneer; Doing the impossible! Encourage creativity, imagination, and innovation CANI - Constant And Never-ending Improvement (kaizen)"
6838388,"0.30828591486383006","Hills & West - Product Design | Interior Styling & Decorating Web: http://www.hillsandwest.com Instagram: http://instagram.com/hillsandwest & http://instagram.com/hillsandwestinteriors Facebook: http://facebook.com/hillsandwest Twitter: http://twitter.com/hillsandwest Pinterest: http://www.pinterest.com/hillsandwest For all enquiries please contact us at: aisha@hillsandwest.com"
5696301,"0.30838124552220214","Welcome to your new rental home or rental duplex in Springfield and Ozark with excellent amenities, pet friendly, privacy fenced, garages, excellent locations. BEN-STEELE PROPERTIES, LLC, is more than a full-service management company with over twenty years of experience. The team provides exceptionally experienced management, caring managers and many amenities at our convenient locations. Whether you are in the market for an duplex, house or office, our ""homes"" offer a good value for excellently maintained properties.  Enjoy several floor plans, one to three bedrooms, spacious shaded grounds, 24-hour emergency maintenance, mature landscaping, and large units. Our ""homes"" are located close to shopping, malls, restaurants, theaters and grocery stores. Most of our ""homes"" are pet friendly.  Call BEN-STEELE PROPERTIES, LLC, today to see your new ""home""."
3240103,"0.30839340040721974","The firm of Constantine George Pappas AIA Architecture/Planning has served the needs of the Institutional, Commercial and Religious Communities through a variety of master planning, renovation, preservation, and new construction solutions. We work closely with Owners to properly define their overall program needs, schedule, and budgets, while enhancing their community."
1378601,"0.3084120382771397","Artésa Financial Group, an independent investment advisory firm. Designed for the client, Artésa provides wealth management services including: investment advice, asset allocation strategies and portfolio construction recommendations. Our Founding Partners average nearly two decades of experience assisting clients with their financial needs. Offering conservative guidance based on a risk-first methodology, Artésa Financial Group understands that traditional allocations can be limited in capturing investor's personal concerns in collaboration with current market risks."
3958854,"0.30841827838093905","Based in Birmingham, Alabama, and working throughout the Sunbelt region, we specialize in developing Class A multifamily apartments that improve the lives of our residents, benefit our communities and provide solid returns for our investors. Our work centers on integrity, from the strength of our construction to the responsibility of our business practices. We’re committed to quality execution and honest, open communication with our investors and residents."
1507191,"0.3084494493797837","The ARM (Advanced Robotics for Manufacturing) Institute accelerates the development and adoption of innovative robotics technologies that are the foundation of every advanced manufacturing activity today and in the future. We leverage a unique, robust and diverse ecosystem of partners across industry, academia and government to: - make robotics, autonomy and artificial intelligence more accessible to U.S. manufacturers large and small - train and empower the manufacturing workforce - strengthen our economy and global competitiveness - elevate our national security and resilience The ARM Institute operates as part of the Manufacturing USA network, and is funded by the U.S. Department of Defense. By creating a collaborative ecosystem of like-minded organizations, the ARM Institute is speeding the movement of industrial robots into commercial use, while preparing a labor force to operate and manage these technologies. ARM is an integral part of Pittsburgh’s strategy to define the future of the global manufacturing economy and will be the lead tenant at Hazelwood Green, a unique hub that will revolutionize U.S. manufacturing. For more information, visit www.arminstitute.org."
3016130,"0.3084561089381912","Aquarius Fish Co Llc is a food production company based out of 314 W 300 S, Salt Lake City, UT, United States."
4924672,"0.30851036088257544","Dr. Michelle Copeland is a Harvard-trained plastic surgeon, biochemist, best-selling author, and creator of a best-selling line of skin care products. Her skin care products come with a 30-day, unconditional guarantee and are clinically tested and specially formulated to reduce signs of aging—helping you achieve and maintain supple, vibrant, healthy-looking skin."
4121588,"0.3085154155456029","At Nadus Films, we believe stories can change the world. We also believe that the work you're doing is helping impact our culture for good. We understand the importance of communicating that impact in order to advance your vision and compound the positive change you're making. For more than a decade, Nadus Films has been making films that make a difference. Derived from content rooted in some of the most pressing issues that affect our world, we are the architects, builders, and deliverers of content that will advance your mission. Nadus Films has helped its domestic and international partners grow their annual revenue from thousands to millions and even billions. We see both for-profit and non-profit agencies fail, time and time again, because they do not invest in the proper approach. To determine the right method for you, we listen to what story needs to do for your brand, we engineer a concept to bring about the impact your trying to achieve, and then we’ll focus all of our energy and resources on telling your story in the most effective, innovative, and powerful way. Let us tell your story."
3896001,"0.3085609122703816","It's about valuing what was handmade, the simple, clean and handmade. Our products are born from ideas and share stories, because we rescue the true essence of ""handmade"" in our products."
5055581,"0.3088474479661002","Faith Early Childhood Ctr is a human resources company based out of 431 S Arlington Heights Rd, Arlington Heights, IL, United States."
4145638,"0.30932911094001514","New Milford Public School District continues to represent a district on the move. Test scores are on the rise; the professional advancement of faculty is increasingly manifesting in enhanced lesson design; and ongoing program development is characterized by intelligence, imagination, and sense of purpose. The administration and faculty think interms of possibility. Young at heart, vibrant and open to new ideas, they value working collaboratively and understand the importance of maintaininga consistent focus on the central mission of educating children. Organized into professional learning communities, teachers are dedicated to the advancement of student achievement and the enrichment of the total school experience."
6413999,"0.30971495028908014","North Side Grille is your neighborhood restaurant serving Breakfast, Lunch and Dinner. Our menu is based on simple American fare comfort food where the taste and quality stands for what we believe in. Coming to the Grille, you will get a full experience no matter the time of day. Located in Hudson, NH. Order Online. Dine in or Take Out. Catering available."
3554748,"0.30973734739573133","Fire Roasted Coffee is a specialty roaster located in London ON. We started with the idea that your coffee cup in the morning should be ethically and sustainably sourced and that it should be made consistently every time. Our network of Fire Roasted Coffee Co. retailers includes a wide variety of partner organizations from grocery chains, and college/university dining halls, to restaurants, cafés, and farmers’ markets."
2727340,"0.3097447774042311","Hyundai dealer with branches in Monterrey, Chihuahua, Juárez, Parral, Delicias and Nuevo Laredo. We offer the experience of driving and buying a high-quality car or SUV with which you can live new and great experiences aboard a Hyundai that offers great security for the whole family."
2277302,"0.30988666120568953","Purveyor of fine teas from New York City. Luv Tea blends, bakes, and supplies the top tea-houses in NYC and select restaurants."
6347549,"0.30996785700511686","Toddler Thing, Our clothes are just like friends, you want quality, Not quantity. And as unique and beautiful as you are!"
5125107,"0.30997878730676276","Larson Tax Partners is a full-service tax firm, providing tax planning and tax preparation for individuals, businesses, trusts, and non-profit organizations. We are dedicated to providing our clients with professional, personalized services and guidance covering a wide range of financial and business needs. Larson Tax Partners, LLC is affiliated with Larson Financial Group, LLC, Larson Financial Services, LLC, Larson Capital Management, LLC, and Larson Commercial Real Estate, LLC. All of which is part of Larson Financial Holdings."
5587457,"0.30999891519572376","Houseit, is a Real Estate Services Company based in Dubai, UAE, that was formed in 2013 and specializes in sales, rentals, property management, and technical services. Houseit is driven by a team of passionate people having deep experience and understanding of the Real Estate market and is led by a Management that consists of individuals with vast experience in Real Estate, Supply Chain Management, Finance, and Hospitality Services having previously served in strategic & senior management roles in major multinational corporations. We are committed to delivering exceptional services to our clients by offering the smartest, most luxurious, and yet affordable housing alternatives by leveraging our networks and knowledge of the real estate market. With an impeccable track record in the real estate business in Dubai, Houseit is on course to revolutionizing housing services through innovation and state-of-the-art systems & processes becoming a one-stop solution for housing needs."
4525702,"0.31002569615381304","Sottile & Barile, Attorneys at Law, is a law firm based out of Northern and Southern Ohio. The attorneys with Sottile & Barile focus their practice on state court collection matters and creditor representation in bankruptcy proceedings, real estate foreclosure as well as real property and business transactions in state and federal courts throughout Ohio, Kentucky, Indiana and Michigan and in the federal courts of Illinois, Colorado, Wisconsin and Washington D.C. We provide a business approach to our clients’ legal needs and insist upon fair dealings with our clients, courts, legal professionals and opposing parties. We seek to provide legal support to clients both large and small because we believe that legal services should be based on the need and not the size of the company."
6369460,"0.3100946936039287","We help you protect what you’ve worked so hard to build. AC financial Group LLC specializes in providing individuals and families with comprehensive employee benefits such as healthcare guidance, life, disability, and long-term care insurance. It doesn’t matter if you work for yourself or employ others, we work on your behalf to find comprehensive benefits that will cover you the way you want to be covered and at a rate that will fit your budget. AC Financial Group deals with only the most reputable insurance companies with a proven track record of high quality service, prompt payment of claims, and reasonable premiums."
4828907,"0.31018940745654155","Women of Color in Pharma (WOCIP) is a 501(c)(6) non-profit professional society with a network of 4000+, and members across the US, Latin America, Europe and beyond. Our membership includes women from various educational backgrounds, organizational levels and functions within the pharmaceutical and life science industry, from entry level to senior executives. WOCIP is the professional society of choice for Black and Latina women who currently work in or aspire to build a career in the Pharmaceutical industry. Our Mission: To empower women of color in pharma to excel in their personal and professional development and to transform their pathway within the pharmaceutical industry. Our Vision: To enable transformation of the pharmaceutical professional landscape for women of color. Our Purpose: To create a nurturing/safe environment for self-reflection/discovery amongst Black and Latina women to foster personal/professional growth that will address a critical gap required to promote innovation/leadership. Our Values: Self-Investment, Entrepreneurship, Thought Leadership, Innovation, Stewardship, Authentic Connection, Personal and Professional Growth. Join Us: https://wocip.org/memberships/"
1819887,"0.3102966958107424","Englishcafe is a company dedicated to teaching English through a new concept based on bringing the language closer to the student through a 100% oral method developed by native teachers and in a relaxed atmosphere with classes in charming cafes."
2253780,"0.3103956210141585","The Steamboat Grand blends the spirit Steamboat’s western heritage with superior guest services and the finest amenities resulting in a luxurious getaway deep in the Colorado Rocky Mountains. Located at the base of Steamboat Ski Resort, the seven-story Steamboat Grand features 328 beautifully appointed guestroom accommodations, ranging from studios, parlors, double queen and king hotel rooms to one-, two- and three-bedroom condominiums as well as eight luxurious penthouses. The Grand is home to award-winning dining, a full-service spa and fitness center, an outdoor heated pool and two large whirlpool spas, as well as 17,000 square feet of indoor/outdoor convention space highlighted by the hotel’s centerpiece 5,484-square-foot Korbel Grand Ballroom."
5432081,"0.3104962932471831","At Peffers Law we are sensitive to the issues that bring you to see a lawyer, whether they are drafting a corporate contract, planning and drafting estate planning documents, or the administration of a loved one’s estate. We approach each matter with kindness, professionalism and compassion. We can help."
3408080,"0.3105168979435733","DiscNW promotes mutual respect and fair play, demonstrates the value of team sports for health and social benefits, and performs outreach in the community. This values-based, or the ""Spirit of the Game,"" approach has guided the agency and defines the organizational culture. DiscNW is a 501(c)(3) non-profit organization based in Seattle. We run Ultimate Frisbee leagues, tournaments, camps, and clinics throughout the year. Our focus is on coed recreational play and youth ultimate, and we offer financial assistance for youth players, so they can focus on playing, not paying."
5234002,"0.31068021261570167","The Mining and Environment Research Institute (IRME) UQAT-Polytechnique was founded in 2013 by the University of Quebec in Abitibi-Témiscamingue and Polytechnique Montreal. Unique in Quebec, this joint research program was created in association with several mining partners. Focused on the environment and the management of mining waste, the Research Institute aims to develop environmental solutions for the entire life cycle of a mine. The Research Institute on Mines and Environment (RIME) UQAT-Polytechnique was founded in 2013 by the Université du Québec en Abitibi-Témiscamingue and Polytechnique Montréal. The only one of its kind in Quebec, this joint research program was created in association with several mining industry partners. Focused on the environment and tailoring management, the Research Institute develops innovative environmental solutions for the entire life cycle of a mine."
3473280,"0.3106947211340889","Elite Warranty, Inc. is headquartered in Springville Utah and has been selling affordable, best in class vehicle service contracts since 1998. We have an A+ rating from the Better Business Bureau and our contracts are backed by insurers with more than $150 million in assets. We offer a full range of plans from basic drivetrain to full factory-type protection. We also offer GAP that pays 130% of NADA retail value of the vehicle. Our name reflects the quality of our products — Elite"
4265443,"0.3107633590698047","Photos from the Harty is a team of award-winning professional photographers based in MD, VA, DC & all over the world. We tell your story through our images. We capture events, weddings, engagements, portraits, anniversaries, proposals, parties, & much more!"
6865837,"0.31086846058773676","Founded in 1982 by Terrence Timmins, CLKC Holdings Inc is a privately owned company headquartered in Orono, Ontario , Canada."
6238783,"0.311058029876225","We started as a small storefront on Peachtree Road in 2012. Our goal was simple, to produce a fresh and flavorful popcorn by hand using only quality ingredients from chef-driven recipes. Our family continues this mission today-brining you the same flavorful, honest, small-batch popcorn as the day we first opened our doors. The result is a variety of Sweet, Savory, and Spicy flavor options with a Southern Flair. You can find our products online at www.cajapopcorn.com or at independent retailers in the southeast."
6564414,"0.31110565000141654","Visit The Crown and Sceptre in South Croydon, home of outstanding beer & cider, great wines, mouth-watering fresh food and exceptional service."
2341584,"0.31117175551134213","The Centre for the Internet and Human Rights (CIHR) is a vibrant hub for academic research about technology and society."
5573011,"0.311218742510304","Pediatric & Adolescent Urgent Care of WNY provides quality care that is never too far out of reach for families with children. Serving Buffalo, Amherst, Williamsville & Clarence, NY. Contact us today!"
3413831,"0.3112390842664364","We strive to make meaningful work that shares messages, ideas, concepts, and stories that matter. Stories that are bigger, that are more imaginative. We don’t want to follow a society that is afraid to try, to think outside the box, that treats audiences like idiots. We want more than “likes”, we want to engage our audience, to make them dream, teach them, inspire them. We’ve worked with clients from around the corner to around the world. We have shot in 35 different countries, worked with more than 50 major brands, made hundreds of ad campaigns, documentaries, music videos, commercials, fashion videos, short films, streaming and we’re just getting started. We are more than an international collective, we are a family. We are a small team bound together by an insatiable thirst to create. Each member is multi-talented and has a diverse skillet, from writing, editing, producing, shooting, making music, fixing to fx’s, we do it all. It’s the sum of our parts which sets us apart. We are DMBZ and we play by a different set of rules."
2859108,"0.3113455811717055","ABRAM LAW GROUP is a law practice company based out of 1200 ASHWOOD PARKWAY, STE 560, ATLANTA, Georgia, United States."
5473824,"0.3113467097282214","With over 50 years of growing experience the DiCiocco family has led the industry in perfecting the art of growing consistent, premium hydroponic produce that is superior in taste, quality and provides maximum shelf life. Located in Leamington Ontario the &"
3235355,"0.3113567604251374","Two soundproofed film studios based in Central London that have been lovingly crafted in two film stages and a canteen."
1991634,"0.3114527356523672","Microcredit, this stranger! Microcredit is a financial instrument that aims to respond to the financial inclusion needs of those who have difficulty accessing traditional credit. It is not simply a small loan, but an integrated offer of financial and non-financial services. What distinguishes microcredit from ordinary credit is the attention to the person, which translates into welcoming, listening and supporting the beneficiaries from the pre-disbursement phase to the post-disbursement phase, as well as the particular attention paid to the validity and to the sustainability of the project. The microcredit tool, in the form of &quot;entrepreneurial microcredit&quot;, is aimed at all those who intend to start or develop a business or self-employment activity and/or who have difficulty accessing bank credit. Who can get funding? - Self-employed workers with a VAT number for no more than 5 years and with a maximum of five employees; - Sole proprietorships with a VAT number for no more than 5 years and with a maximum of five employees; - Partnerships, partnerships between professionals, simplified limited liability companies and cooperatives, associations, (the latter registered in the Chamber of Commerce) holders of a VAT number for no more than 5 years and with a maximum of 10 employees How does it work? What is the procedure to follow? If you are interested, because you have a business idea to set in motion, register and inform us broadly about what you would like to do. We will put you in touch with our tutor."
1909580,"0.31146419439359885","INNOVATIVE BY CHOICE, HUMANE BY DESIGN Hairstetics researches, develops and commercializes innovative hair restoration devices for alopecia suferrers. Motivated to move the line of an industry that didn’t innovate for long, Hairstetics developed a unique technology making hair implantation available to everyone (especially to female), providing immediate satisfaction and natural outcomes. A key driver to bring back confidence to millions of sufferers."
5659720,"0.31160299501347666","Premier Dermatology MD provides diagnosis and treatment of skin, nails, and hair disorders, laser and light treatments, and cosmetic removal of moles, skin tags, and cysts. Their services include skin care regimens and acne scar treatment."
3169960,"0.31164926484382005","Briarville is a leading tobacco pipe repair company, smoking pipe repair and restoration shop serving clients worldwide. We are the place for the pipe enthusiast and hobbyist to have their ""Cherished Companions"" serviced when necessary. Our Mission Statement is simple: A client well served is a client for life. Briarville is very proud to be the preferred repair and restoration vendor of both the TPC/GPC and the Southern Fried Pipe Club where over 4000 members get special discounts and perks. In addition to repair and restorations, Briarville operates an online store for tobacco pipe accessories and completely refurbished and sanitized Estate Pipes."
3305382,"0.3116682806608163","Confluence is a clinically-intensive mental health treatment program treating young adults with emotional, substance use and relational challenges. The program combines wilderness adventure therapy with a residential experience, farm programming, and comprehensive health and wellness services to guide young adults facing mental health challenges towards engaged, positive and fulfilling lives."
2992346,"0.3118681760148583","The attorneys at Andrews DeValerio have decades of experience in business litigation and prosecuting class actions on behalf of institutions and individuals and recovering losses caused by violations of securities, antitrust, consumer, and employment laws."
4128729,"0.3119206094978412","Natural Therapy is a company built by therapists passionate on providing a community focused on holistic therapy solutions to promote empowerment for self-healing of the mind, body and spirit to flourish on the pathway of optimal health. Our Natural, non-invasive solutions approach starts by looking at the whole person not just the symptom which means an unparalleled experience to ensure that you feel heard, respected and understood. Our services involve a balanced eastern and western approach including Traditional Chinese Medicine in Acupuncture and Herbology along with integrative offerings in Nutrition, Massage, Occupational Therapy, Lymphedema, Yoga, and Tai Chi. We are located at the cornerstone of the historic Old Market District nestled on the southeast corner of 13th and Leavenworth in Omaha, NE. We have safe, secure and free parking. Natural Therapy 1219 Leavenworth Omaha, NE 68102 402-995-9874"
