"company_pk","cosine_distance","text_raw"
2054687,"0.28849036303334774","Apollo Solar provides the residential, commercial, and remote telecom PhotoVoltaic (PV) markets with innovative, technologically superior electronics that have served industrial clients for decades. The sole focus of Apollo Solar is to increase performance and enhance reliability of PV systems, reducing the upfront and life-of-system cost of residential, commercial, and remote telecom PV installations. Our History: 40 Years of Exceeding Expectations Apollo Solar is a spin-off of Electronic Design Lab (EDL), a Connecticut company with extensive experience in the design of industrial strength electronics. We have 40 years of experience in meeting detailed technical requirements and in exceeding cutomers expectations regarding ease of doing business. Power management projects have been completed for: *NASA *Branches of the United States Military *the US Department of Energy *Fortune 500 companies: IBM, General Electric, Duracell, Siemens, DuPont, etc. Apollo Solar brings innovative power management capabilities that increase the efficiency, reliability, and cost-effectiveness of photovoltaic power systems through its full line of inverters, charge controllers, and monitoring modules for PV power management systems. Hallmarks of Apollo Solar Products: Internet-based remote data-monitoring Designed for fast, fail-safe installation Feature exclusive built-in energy-performance meters Reflect robust thermal design and optimal solar energy harvest"
6209975,"0.28849930372846533","Canada's most trusted provider of Food Handler Certification. Earn your certificate online. Go at your own pace. Best value. Fun, Fast & Easy."
5851112,"0.2885005474090374","Bestflake provides a fresh and reliable source of the finest fish food and aquarium supplies at factory direct prices. Their popular food products are tropical flake food, brine shrimp flakes, and Cichlid pellets."
1726150,"0.28851589902761476","In Christine's quirky, independent, literary bookstore Bosch and Folco de Jong you will always find something in the Fenix ​​Food Factory what you were (not) looking for."
3557562,"0.28856835629247124","Learn English for preschoolers, children, and teenagers through the FisherSuperkids English system in Da Nang - CULTIVATION FOR GLOBAL CITIZENS"
2658960,"0.2886062596421648","KickPoint Financial, they are solely focused on your goals and what it takes to achieve them. The KickPoint experience is client-driven; each solution is unique, flexible, and objective."
2647572,"0.28868260119309663","We are an independent communication agency born in 2014 from the meeting of advertising, digital and audiovisual communicators. In the digital age, we combine this triple culture to imagine (strategy), tell (creation) and broadcast (production) beautiful stories in order to bring out your brand and allow you to seize all the new creative and business opportunities of a changing world."
5720272,"0.288687100723481","We have two different sides to our yard here at Jackson Auto Salvage. We have our full service section where we pull the parts for you OR we have our U-Pull it where you can pay two dollars and pull the parts at a cheaper price. We have two different sides to our yard here at Jackson Auto Salvage. We have our full service section where we pull the parts for you OR we have our U-Pull it where you can pay two dollars and pull the parts at a cheaper price.   90 Day Warranty on all Refurbished Batteries, Engines, Transmissions, Axles, and Transfer Cases - 30 Day Warranty on Everything Else. Exchange or In-Store Credit Only - No Cash Refund.   We have a huge selection of hubcaps, wheels, and used tires!  Be sure to check out our website for more information!  TEXT (919) 634-0988 TO SELL US YOUR VEHICLE!"
6723095,"0.2890376488234636","SolderStick is the best way to make a waterproof connection. With our waterproof solder wire connectors, you can create quality and waterproof wiring connections in seconds. Buy online today and get free shipping!"
2118696,"0.2890415694614483","LiteraSeed™ is a technology startup with the mission of improving person-centered care and reducing preventable medical errors. By focusing on communication, LiteraSeed breaks down barriers between patients and providers. Literaseed provides a digital health platform that assists patients to efficiently describe their present symptoms and history in their own words and language, allowing their providers more hands-on time to make an accurate diagnosis and provide personalized care."
4710878,"0.28906943928367124","TSP Ventures is a Venture Capital firm backing transformative hard science solutions to our most pressing environmental and climate challenges. Our core belief is that businesses must serve the long-term wellbeing of people and of the Earth and we strongly believe that having a noble purpose and making money should not be viewed as mutually exclusive."
6207413,"0.2890809350657705","C4 Funds is an Impact Investor who focuses on 'Better for You' Consumer concepts that have an environmental, sustainable, fair trade give back component."
3460405,"0.2893236279487408","Multi-dimensional online education for Generation XYZ. Our team offers online tutoring, test preps, and other services with tutors in the expertise of Math, Science, Engineering, Chinese, English, Music, and Design. Our experienced and certified tutors are alumni or graduate students from top universities like UCLA, USC, Columbia, and Parsons. Let us guide you to success in your online education. Subjects: Maths, Physics, Chemistry, Biology, English, Chinese Test Prep: SAT, ACT, AP, GRE, TOEFL, IELTS Other Services: Translation, Music, Design, School Applications Free consultation and discounts are available on our website."
5939360,"0.2894276114023877","BrainSpark® Talent Development is an employee assessment and talent development solutions company that helps businesses align talent with strategy; hire the best candidate more efficiently; and develop leaders, teams, and mission-critical employees. BrainSpark® serves clients across all types of organizations, industries, and sectors – from Fortune 500 companies to small businesses and nonprofits."
4959456,"0.2894845432350198","Founded in Edinburgh, Scotland in 2021. Project Harmless offers innovative and environmentally friendly products and services. Our first product, Harmless Poop Bag, is a water-reactive dog waste bag which rapidly disintegrates in the open environment, particularly our rivers and oceans. Harmless Poop Bags are also non-toxic and safe for marine life. Learn more: https://projectharmless.com"
6495374,"0.2894943529065742","We are a fabulous, locally owned, women's clothing boutique located in Franklin, Tennessee that has a passion for offering stylish, casual, and fun wardrobe staples to our customers."
2386000,"0.28950106155847033","We enjoy learning new stuff every day and we love teaching it to others even more. We want learning to be both fun and efficient. That's why we help people to get a deep understanding of different technologies. If you aren’t satisfied with our material, then we aren’t either. We Teach At thoughtram we regularly organize workshops, webinars or even free training days near you. If you can't make it to one of our events, contact us for in-house workshops at your company. We Code We love coding. And we also believe in open source. That's why we contribute to many projects with people from all over the world to push things forward. Check out our latest open source projects. We Build Our experience and expertise makes it possible for us to write books or build tools and applications that make developers life a lot easier. Head over to our products to find out more!"
2820310,"0.2898629307746685","Ultimi Total Projects offers a total solution in the field of interior design, renovation, conversion, and contracting. They renovate, convert,  interior design, contracting, and implementation for private and professional new construction or existing buildings."
5175918,"0.2898700660544481","GP Murillo offers paintings, wallpapers, and accessories. Their products include neo collections, family collections, pandora collections, and secret collections. They also provides plasters, tools, paper to protect, putty, boards, glues, and adhesives. They sell their products online."
7017071,"0.2900157475433951","InkMASH started in 2011 as a t-shirt printing company with a goal of delivering excellent quality product, printing and service, all with the convenience of being able to order online. Since then we've consistently delivered on our promise and have continued to expand our product and printing capabilities to include the best in the market product personalization options and the latest apparel and gift item decoration technologies. We're not done yet however, we're always working hard to further push the boundaries of what we are able to offer and always have many new developments in the pipeline. Our biggest motivation is being the trusted source in the UAE for many individuals, groups and organizations for their custom t-shirts, accessories or gift item requirements."
2249722,"0.29008333146074283","Noisy Beast is an integrated, independent and international full-service communications agency with a proven record of growing brands. We’re free from old traditions, legacy systems and the way it used to be done. We’re 7yrs young, built by a brand for brands, seeing every challenge as an opportunity. We believe that a healthy culture brings out the best in all of us, which is why, at Noisy Beast, there’s always something to look forward to. From a netball championship to a string of summer barbecues, we love keeping on our toes and embracing all things new."
4445905,"0.2901443877687029","Scribe Publishing Company is a traditional, royalty-paying small press that uses IPG for national distribution. Our mission: To have freedom of thought; to move across the earth unrestricted; to pursue your happiness; that we may be the scribe to your voice, wander and wonder."
5389501,"0.2902361789134502","Vent Pro Mechanical is C-NRPP certified in Radon Measurements and Mitigation Services and a full service HVAC Contractor with over 20 years experience. We strive to provide the best service and installation available and guarantee our work 100%."
6995903,"0.2902605187582301","Get The Best Heating OIl Prices In Long Island NY and Queens NY From S&S Fuel. Online Ordering, Easy, 24/7, Fast Delivery Service. Low Oil Prices."
4331328,"0.29028002292749777","We help you build People Experience & Operations through Learning, Coaching & Community to meet the demands of a complex business world, develop agility & modernise Human Resources."
6783320,"0.29030649123748054","MediaFutures will set up a virtual, European data innovation hub, including funding, mentoring and support for entrepreneurial and creative projects to reshape the media value chain through responsible, innovative uses of data. We will: • explore the critical factors that impact how people engage with bottom-up quality journalism, science education and digital citizenship; • define a participatory, inclusive innovation programme, leveraging impulses from multiple disciplines, as well as synergies between entrepreneurs and creatives; • organise a competition addressing pressing technical, economic and societal challenges in the media value chain to identify promising digital entrepreneurs, creatives and data-empowered solutions; • provide data and experimentation facilities for the winners of this competition to test and nurture their ideas; • support 51 businesses and 43 artists by solving common concerns around funding and access to mentoring in technical, legal, business, media and sustainability matters; and • create toolkits and best practices for innovators, creatives, and other stakeholders to achieve greater traction for their citizen-centric initiatives, and empower them to communicate through data in inspiring, informative and engaging ways."
2975721,"0.29034554958341485","Listen online to relaxing sound atmospheres, ambient music or chilling sound effects. You can even create and mix your own moods, all for free."
6993858,"0.29038321009082557","Moero is a minimal wallet with RFID protection for contactless cards. It offers the possibility of containing up to 10/12 credit cards, old documents and coins."
3494139,"0.29052965866812264","Orlando’s OG Coffee Company (est 1927). Fresh-roasted coffee hand delivered to your doorstep. The only way to buy is to visit EolaCoffee.com and sign up, or email us at hello@eolacoffee.com for corporate orders."
2665034,"0.29065397484825395","Los Angeles Junk Removal Company, BumbleBee Junk was founded in 2015. Located on the border of Burbank, CA in Sun Valley, the company began with one pickup truck in a garage. It has since grown to include a fleet of junk hauling trucks, trailers and pickups removing junk throughout the San Fernando Valley.  A professional junk removal service, BumbleBee Junk now also serves the Southland from Monrovia to the east to Simi Valley in the north and as far away as Thousand Oaks to the west. Our growth is the result of hard work and attention to customer satisfaction. We always go the extra mile and we make sure we clean that formerly junk-filled area before we haul your junk away. Junk to us means anything you don’t want and we will remove junk including old mattresses, old appliances, CD or DVD collections, vinyl records, old furniture, old or non-functional electronics, old clothes and almost anything else (hazardous materials excepted). We wan to be your Van Nuys junk removal company, your Burbank junk removal company, your junk removal service. If you’re in the greater Los Angeles area and need junk hauled away, we’re the number you need to call."
6468802,"0.29082458238015596","Official LinkedIn page of the Emprega Indaiatuba portal. The job channel that the city of #Indaiatuba deserves! We operate within a collaborative philosophy, we are 100% free for those who want to advertise vacancies and for those looking for a new job."
2859798,"0.29083085440120615","As an independent financial planning and wealth management firm in our hometown office of Cody, we offer comprehensive, objective advice to individuals, business owners and multi-generational families. Our mission is to have a meaningful impact on our clients’ financial lives by striving to provide confidence that someone with integrity is in their corner throughout every stage in life. The result: we'll help you design your own personal legacy that's suitable for you and your personal vision of success. Working as a fiduciary to our clients, it is our legal duty to put our clients’ needs first and act in their best interest while maintaining full transparency throughout the financial planning process. Our name and reputation reflect the high standards we have and the honest work we do for the people we serve."
6220089,"0.29087329290449193","Lugga is a language learning mobile application which connects prospective learners of language, teachers and native speakers. Once you are signed up Lugga allows learning with a teacher/speaker in real time via Text, Voice and Video calls. Learners are able to see and request lessons from teachers all around the world. Speak your chosen language with a real person from day one! Lugga gives you the convenience of instantly finding an available teacher and scheduling a lesson right away! At the click of a button you will have plenty of speakers to practice with making your dream to learn a second language a reality. Whichever stage you are as a learner using other programmes out there, switch to Lugga for the ultimate one to one, real time learning experience. Lugga spoils you for choice. you get to see a list of available teachers from around the world. Choose one and send a request. Once accepted and payment is made the lesson starts immediately! At the end don't forget to leave feedback for your teacher. You also have the convenience of planning lessons ahead and around your lifestyle. Lessons can be scheduled in advance by requesting the specific time you want your lesson to start. When the time arrives the lesson commences automatically. This is convenience at its best. Let Lugga do the hard work for you. Never struggle again to find your perfect teacher. Lugga takes away the pain of rummaging through the internet trying to find a language teacher and puts a whole world of convenience and choice right in your pocket. With Lugga, your exciting journey starts now."
1895453,"0.2909457125414192","BUILDIN is dedicated to leading the early adaptation of Blockchain technology to the evolving Real Estate marketplace, to the benefit of all the parties involved in the transaction, from the buyer to the broker, BUILDIN personalizes the transaction."
6686495,"0.2910873022415321","The Ajman Department Of Finance is proud to present AjmanPay. An easy and safe gateway for electronic payment and revenue collection for both government and non-government fees. Through the latest technologies we offer world-class secure and effective payment & collection schemes. AjmanPay system ensures the best coverage, making it an integral electronic payment system in Ajman."
5656551,"0.29110504706917006","Lakeshore Apartments specializes in providing apartment homes. Their floor plans include a studio, bedroom, and kitchen with a dining area. They also provide a mobile application and residential portal that help to find apartment homes."
2461178,"0.29110818723807586","Smart Chemist is a safe, secure & confidential UK registered Online Pharmacy, empowering you in making the smart choices for your health. With patient care and ethical decision making at the heart of what we do, our London based team work together to provide an efficient and effective service for the long-term health and wellbeing of our patients. We provide safe access to prescription only treatments for common lifestyle conditions such as Erectile Dysfunction, Emergency Contraception, Allergy Relief, Hair Loss, Weight Loss, Cystitis, Acne, Migraine Relief, Period Delay, Premature Ejaculation and much more. Owned and operated by Smart Health Europe Ltd, Smart Chemist is a MHRA registered seller meaning we provide access to genuine and authentic branded and generic prescription medicines such as: Viagra (Sildenafil), Spedra (Avanafil), Priligy (Dapoxetine), Utovlan (Norethisterone), Telfast (Fexofenadine), Imigran (Sumatriptan), Zolmitriptan, Rizatriptan, Trimethoprim, Levitra (Vardenafil), Cialis (Tadalafil), Propecia (Finasteride) and many more. For expert advice on our treatments, or more information, visit our website or speak to a member of the Smart Chemist team today."
2201728,"0.2911275202707644","Winedering.com is the first international marketplace that connects wineries around the world with millions of wine travelers. Winedering's mission is to increase the opportunity for wineries to get in touch with wine travelers through a very simple and essential tool: an online marketplace to book and review the best winery experiences in the world. With more than 45,000 wineries and 60 million wine travelers, Winedering is the first platform that helps wine travelers find wineries and book experiences online. A wine traveler, through winedering.com, can search for wineries or destinations, find reviews from other wine travelers, choose the best experience and book it online! For wineries, Winedering is a powerful branding tool. Wineries, in fact, can have a dedicated page in Winedering.com, upload experiences to sell online, images, events and information to increase their visibility, which will grow as the number of bookings and reviews received increases! Finally, wine tourism: Winedering is also a Tour Operator that creates special wine tours all over the world, giving wine travelers the chance to find ideas and suggestions for their next vacation."
1347260,"0.2911579956004161","We're making education more effective through customization. We learn the strengths and weaknesses of learners and create tailored learning programs. We create compelling educational experiences for our students by truly understanding their problems."
6134621,"0.29119203739212585","Ohmic is working on the next stage in wearable technology. We aim to bring biometric sensing to headphones everywhere."
3612633,"0.29126644886735875","Since 2017, we have enabled premium brands to achieve increased revenue streams and consumer engagement by monetizing their digital identity through NFTs sold both as authentic collectibles and in-game items (i.e., skins). We provide our clients with the right enterprise-focused trifecta of technology, people, and process to align with their own corporate high standards."
2893189,"0.29165345430372136","Adult Beverage Solutions (ABS) is a sampling company that primarily conducts alcoholic (and non-alcoholic) tasting demos servicing Illinois, Michigan, Indiana, Wisconsin, And Iowa. We are always searching for strong candidates to grow our company and represent us in the industry. Candidates with previous sales and/or demoing experience are preferred."
2708240,"0.2917528052919375","Racer Signup provides online race registration for running races and endurance sports. Our mission is to make race registration so simple that it inspires all people across the globe to experience the joy of running, and its benefits of improved health and mental well being."
6926982,"0.2917875995382332","Brands aren't using social media for what it's been designed for and we want to change that, Fresh Movement exists to disrupt the way brands communicate. We believe in the power of fans and the power they have to build brands, they're the soul of a company’s existence and an asset that should be valued & celebrated."
3025838,"0.29181436573903297","ARKÉ is a firm that covers the areas of consultancy in sustainability of projects and works, energy studies, Consultancy in LEED, EDGE Certifications, Paraguayan Standard for Sustainable Construction, as well as SITES and TRUE Certifications. It is also dedicated to environmental impact studies, life cycle impact studies of buildings and carbon footprint analysis."
4032418,"0.29181735710683887","MedeAnalytics provides evidence-based insights to solve a real problem that plagues healthcare – how to use the immense amount of patient data collected across health and care settings to deliver cost-effective care and improve patient outcomes in an integrated way. Health and care organisations across the UK and EMEA regions are turning to us to help them achieve models of care focussed around the needs of individual patients and specific populations. We help them integrate and analyse information to open up possibilities around risk stratification, to model care around groups of patients and to make population health management a reality. In the UK we are working with pioneers that are striving to achieve integrated care models identified in NHS England’s Five Year Forward View. Organisations now need to be well placed to examine patient level data - information around individual patient outcomes, patient cost, patient risk and patient journeys. We offer the tools to enable this, whilst also safeguarding confidentiality. MedeAnalytics has a strong history of working with the NHS and other international healthcare organisations. Our analytics platform delivers intelligence that helps healthcare organisations detect their greatest areas of risk and identify opportunities to improve their financial health. It empowers health and care organisations to collaborate and use data to strengthen their operations and improve the quality of care. Our cloud-based tools have been used to analyse more than 21 billion patient encounters in the United States and the United Kingdom, providing better care to more than 30 million patients and better business for 900 healthcare organisations."
4524263,"0.29186942674285543","Soothe is the world’s leading wellness marketplace, connecting individual and corporate clients with wellness providers who meet their personalized needs through the Soothe app, Soothe Residential & Hospitality, and Soothe Corporate Wellness services. Service providers in Soothe's marketplace offer a range of on-demand services including massage, skincare, hair and beauty services in over 70 markets across the United States, Canada, the United Kingdom, and Australia."
2006400,"0.29188600424349054","PC: $1,500 Keyboard/Mouse: $300 Microphone: $200 Headset: $200 Glasses: $15? What is your health worth? Gamer Advantage is on a mission to create products that genuinely improve the well-being of any and all gamers. We are committed to the wellness of every gamer in the world and will continue to invest in science that produces meaningful results. We believe that it starts with your vision. The eyes are the windows to our general health and can have a significant impact on our day to day well-being. How you treat your eyes directly effects how your brain and body support your gameplay. We attack that with a clinically proven lens technology that helps improve sleep, health, and performance. But it doesn't stop there. Our frames are designed and crafted to be best in class. First we ask ourselves ""Can I wear it under a headset?"" and second we ask ""Can I wear it out to dinner?"". If they style and construction answer yes to both of those questions, then we have created the best pair of glasses you will ever own. If its good enough to game in, its good enough for anyone."
